{
  "format": "poe2-agent-plan",
  "version": 1,
  "name": "Example: Righteous Fire Chieftain (Mirage-league meta tree)",
  "class": "Marauder",
  "ascendancy": "Chieftain",
  "targets": [
    "Warrior's Blood",
    "Heart of the Warrior",
    "Unwavering Stance",
    "Barbarism",
    "Juggernaut",
    "Iron Will",
    "Bloodless",
    "Constitution",
    "Sentinel",
    "Shaper",
    "Devotion",
    "As The Mountain",
    "Purity of Flesh",
    "Disciple of the Unyielding",
    "Sovereignty",
    "Holy Fire",
    "Cruel Preparation",
    "Breath of Flames",
    "Hinekora, Death's Fury",
    "Valako, Storm's Embrace",
    "Tasalio, Cleansing Water",
    "Ramako, Sun's Light"
  ],
  "notes": "Modeled on a popular poe.ninja Mirage-league Righteous Fire Chieftain (level 100, 8.2k life), validated against this deployment\u2019s tree (3.28.0k Mirage). The armour/regen archetype: RF burns you and everything near you; the tree stacks % maximum life (this tree carries ~122% increased life \u2014 tanky archetypes run 115-160%), life regen, endurance charges and Unwavering Stance. Resistances come from gear, not the tree."
}